Title,Body,Image URL,Price,Category,Owner Name
Luxury Car Sale,Get your dream car today!,Link to Car Image, 45.00,Cars,John Doe
Furniture Sale,Upgrade your home decor!,Link to Furniture Image, 1,800.00,Furniture,Jane Smith
Tech Gadgets Sale,Discover the latest gadgets!,Link to Gadgets Image,1,350.00,Electronics,Michael Johnson
Fashion Sale,Stay trendy with our fashion collection!,Link to Fashion Image,85.00,Fashion,Emily Brown
Home Appliances Sale,Make your life easier with our appliances!,Link to Appliances Image, 2,700.00,Appliances,David Wilson
Smartphone Clearance,Upgrade to the latest smartphone models!,Link to Smartphone Image, 600.00,Electronics,Sarah Miller
Vintage Watch Collection,Find unique timepieces in our vintage watch collection!,Link to Watch Image, 1,200.00,Watches,Robert Lee
Outdoor Gear Sale,Gear up for your next adventure with our outdoor gear!,Link to Gear Image, 300.00,Outdoors,Laura Taylor
